{
  "datasetVersion": "1.0.1",
  "language": "en",
  "status": "frozen",
  "cases": [
    {
      "caseId": "irc-v1-001",
      "query": "My domain profile was blocked after several unsuccessful sign-ins; how should support restore access?",
      "category": "paraphrase_synonym",
      "expectedAbstention": false,
      "metadataFilters": {},
      "acceptableDocumentIds": [
        "kb-active-directory-account-lockout"
      ],
      "acceptableChunkIds": [],
      "relevance": [
        {
          "documentId": "kb-active-directory-account-lockout",
          "grade": 3
        }
      ],
      "rationale": "Paraphrases a repeated domain logon failure and the authorized account-unlock workflow.",
      "difficulty": "easy",
      "tags": [
        "identity",
        "lockout"
      ]
    },
    {
      "caseId": "irc-v1-002",
      "query": "Names on our intranet no longer translate to addresses, although direct IP access still succeeds.",
      "category": "paraphrase_synonym",
      "expectedAbstention": false,
      "metadataFilters": {},
      "acceptableDocumentIds": [
        "kb-network-dns-troubleshooting"
      ],
      "acceptableChunkIds": [],
      "relevance": [
        {
          "documentId": "kb-network-dns-troubleshooting",
          "grade": 3
        }
      ],
      "rationale": "Describes hostname resolution failure while IP connectivity works, matching the DNS runbook.",
      "difficulty": "easy",
      "tags": [
        "network",
        "dns"
      ]
    },
    {
      "caseId": "irc-v1-003",
      "query": "Northstar order entry shows a backend unavailable message for the whole finance group.",
      "category": "paraphrase_synonym",
      "expectedAbstention": false,
      "metadataFilters": {},
      "acceptableDocumentIds": [
        "kb-business-application-erp"
      ],
      "acceptableChunkIds": [],
      "relevance": [
        {
          "documentId": "kb-business-application-erp",
          "grade": 3
        }
      ],
      "rationale": "A multi-user Northstar ERP outage and backend error map directly to the ERP article.",
      "difficulty": "easy",
      "tags": [
        "erp",
        "outage"
      ]
    },
    {
      "caseId": "irc-v1-004",
      "query": "An entire department cannot work and has no workaround; what incident level and handoff apply?",
      "category": "paraphrase_synonym",
      "expectedAbstention": false,
      "metadataFilters": {},
      "acceptableDocumentIds": [
        "kb-service-desk-escalation-policy"
      ],
      "acceptableChunkIds": [],
      "relevance": [
        {
          "documentId": "kb-service-desk-escalation-policy",
          "grade": 3
        }
      ],
      "rationale": "Department impact plus stopped work and no workaround requires the documented priority matrix and escalation policy.",
      "difficulty": "medium",
      "tags": [
        "priority",
        "escalation"
      ]
    },
    {
      "caseId": "irc-v1-005",
      "query": "The desktop mail client repeatedly requests credentials, but browser mail is fine.",
      "category": "paraphrase_synonym",
      "expectedAbstention": false,
      "metadataFilters": {},
      "acceptableDocumentIds": [
        "kb-microsoft365-outlook-authentication"
      ],
      "acceptableChunkIds": [],
      "relevance": [
        {
          "documentId": "kb-microsoft365-outlook-authentication",
          "grade": 3
        }
      ],
      "rationale": "An Outlook credential loop with web access working matches the Microsoft 365 authentication article.",
      "difficulty": "easy",
      "tags": [
        "email",
        "authentication"
      ]
    },
    {
      "caseId": "irc-v1-006",
      "query": "A colleague can reach the file server, but my mapped team folder says permission denied.",
      "category": "paraphrase_synonym",
      "expectedAbstention": false,
      "metadataFilters": {},
      "acceptableDocumentIds": [
        "kb-access-shared-folder"
      ],
      "acceptableChunkIds": [],
      "relevance": [
        {
          "documentId": "kb-access-shared-folder",
          "grade": 3
        }
      ],
      "rationale": "Individual mapped-share denial calls for SMB session and share or NTFS entitlement checks.",
      "difficulty": "easy",
      "tags": [
        "permissions",
        "file-share"
      ]
    },
    {
      "caseId": "irc-v1-007",
      "query": "Documents remain pending and the office device appears unavailable to every user.",
      "category": "paraphrase_synonym",
      "expectedAbstention": false,
      "metadataFilters": {},
      "acceptableDocumentIds": [
        "kb-hardware-printing"
      ],
      "acceptableChunkIds": [],
      "relevance": [
        {
          "documentId": "kb-hardware-printing",
          "grade": 3
        }
      ],
      "rationale": "Pending jobs and a queue-wide unavailable printer match the printing runbook.",
      "difficulty": "easy",
      "tags": [
        "printing",
        "queue"
      ]
    },
    {
      "caseId": "irc-v1-008",
      "query": "The approved desktop program closes immediately since yesterday's sanctioned upgrade.",
      "category": "paraphrase_synonym",
      "expectedAbstention": false,
      "metadataFilters": {},
      "acceptableDocumentIds": [
        "kb-software-general-incidents"
      ],
      "acceptableChunkIds": [],
      "relevance": [
        {
          "documentId": "kb-software-general-incidents",
          "grade": 3
        }
      ],
      "rationale": "A crash after an approved update belongs to the general software incident runbook.",
      "difficulty": "easy",
      "tags": [
        "software",
        "crash"
      ]
    },
    {
      "caseId": "irc-v1-009",
      "query": "Remote access stopped accepting my login just after I changed my password.",
      "category": "paraphrase_synonym",
      "expectedAbstention": false,
      "metadataFilters": {},
      "acceptableDocumentIds": [
        "kb-network-vpn-troubleshooting"
      ],
      "acceptableChunkIds": [],
      "relevance": [
        {
          "documentId": "kb-network-vpn-troubleshooting",
          "grade": 3
        }
      ],
      "rationale": "VPN rejection after a password change matches stale credential or authentication-state guidance.",
      "difficulty": "easy",
      "tags": [
        "vpn",
        "remote-access"
      ]
    },
    {
      "caseId": "irc-v1-010",
      "query": "My Windows 11 notebook is crawling and the system drive has almost no capacity left.",
      "category": "paraphrase_synonym",
      "expectedAbstention": false,
      "metadataFilters": {},
      "acceptableDocumentIds": [
        "kb-endpoint-windows-performance"
      ],
      "acceptableChunkIds": [],
      "relevance": [
        {
          "documentId": "kb-endpoint-windows-performance",
          "grade": 3
        }
      ],
      "rationale": "Slow Windows 11 performance with low storage is covered by the endpoint runbook.",
      "difficulty": "easy",
      "tags": [
        "windows",
        "performance"
      ]
    },
    {
      "caseId": "irc-v1-011",
      "query": "A domain user is repeatedly disabled because an old credential may still be saved somewhere.",
      "category": "paraphrase_synonym",
      "expectedAbstention": false,
      "metadataFilters": {},
      "acceptableDocumentIds": [
        "kb-active-directory-account-lockout"
      ],
      "acceptableChunkIds": [],
      "relevance": [
        {
          "documentId": "kb-active-directory-account-lockout",
          "grade": 3
        }
      ],
      "rationale": "Repeated directory lockouts from possible stored credentials match the account-lockout guidance.",
      "difficulty": "medium",
      "tags": [
        "identity",
        "stale-credentials"
      ]
    },
    {
      "caseId": "irc-v1-012",
      "query": "The corporate resolver returns a nonexistent-domain result for a valid internal host.",
      "category": "paraphrase_synonym",
      "expectedAbstention": false,
      "metadataFilters": {},
      "acceptableDocumentIds": [
        "kb-network-dns-troubleshooting"
      ],
      "acceptableChunkIds": [],
      "relevance": [
        {
          "documentId": "kb-network-dns-troubleshooting",
          "grade": 3
        }
      ],
      "rationale": "An NXDOMAIN response for an internal hostname is a DNS troubleshooting symptom.",
      "difficulty": "medium",
      "tags": [
        "dns",
        "nxdomain"
      ]
    },
    {
      "caseId": "irc-v1-013",
      "query": "Northstar says access forbidden for one analyst who may lack the correct application role.",
      "category": "paraphrase_synonym",
      "expectedAbstention": false,
      "metadataFilters": {},
      "acceptableDocumentIds": [
        "kb-business-application-erp"
      ],
      "acceptableChunkIds": [],
      "relevance": [
        {
          "documentId": "kb-business-application-erp",
          "grade": 3
        }
      ],
      "rationale": "A single-user ERP authorization denial maps to application role and access checks.",
      "difficulty": "medium",
      "tags": [
        "erp",
        "authorization"
      ]
    },
    {
      "caseId": "irc-v1-014",
      "query": "Office sign-in cycles endlessly and may be blocked by a tenant access rule.",
      "category": "paraphrase_synonym",
      "expectedAbstention": false,
      "metadataFilters": {},
      "acceptableDocumentIds": [
        "kb-microsoft365-outlook-authentication"
      ],
      "acceptableChunkIds": [],
      "relevance": [
        {
          "documentId": "kb-microsoft365-outlook-authentication",
          "grade": 3
        }
      ],
      "rationale": "A repeated Office authentication loop potentially involving Conditional Access matches the Microsoft 365 runbook.",
      "difficulty": "medium",
      "tags": [
        "microsoft365",
        "conditional-access"
      ]
    },
    {
      "caseId": "irc-v1-015",